{
  "schema_version": "0.1.0",
  "payload_id": "ISSUE-F70F37D09441",
  "exception_id": "EXCGRP-4B19CDE6B1EA",
  "exception_ref": "reviews/exceptions/RUN-OFS003-PILOT-002/TEMPORAL-INTEGRITY.json",
  "exception_group_id": "EXCGRP-4B19CDE6B1EA",
  "exception_ids": [
    "EXC-RUN-OFS003-PILOT-002-TEMPORAL-INTEGRITY",
    "EXC-RUN-OFS003-PILOT-004-TEMPORAL-INTEGRITY"
  ],
  "exception_refs": [
    "reviews/exceptions/RUN-OFS003-PILOT-002/TEMPORAL-INTEGRITY.json",
    "reviews/exceptions/RUN-OFS003-PILOT-004/TEMPORAL-INTEGRITY.json"
  ],
  "run_ids": [
    "RUN-OFS003-PILOT-002",
    "RUN-OFS003-PILOT-004"
  ],
  "exception_kind": "temporal-integrity",
  "unmet_requirements": [],
  "publication_blocked": true,
  "title": "[OpenFS] Owner action required: temporal-integrity",
  "body": "<!-- openfs-exception-group:EXCGRP-4B19CDE6B1EA -->\n\nThis Issue was prepared from structured OpenFS Exceptions that require the same owner action.\n\n- Exception group: `EXCGRP-4B19CDE6B1EA`\n- Kind: `temporal-integrity`\n- Runs: `RUN-OFS003-PILOT-002`, `RUN-OFS003-PILOT-004`\n- Publication blocked: `yes`\n\nRepository records:\n- `reviews/exceptions/RUN-OFS003-PILOT-002/TEMPORAL-INTEGRITY.json`\n- `reviews/exceptions/RUN-OFS003-PILOT-004/TEMPORAL-INTEGRITY.json`\n\nReview the repository record before taking action. Raw external-content error messages are intentionally excluded from this Issue body.",
  "labels": [
    "openfs-exception",
    "needs-owner-action"
  ],
  "deduplication_marker": "<!-- openfs-exception-group:EXCGRP-4B19CDE6B1EA -->",
  "generated_at": "2026-08-23T21:00:00Z",
  "publication_status": "prepared"
}
